{
  "schemaVersion": 1,
  "id": "kevin-mcguire-for-francis-howell-school-board",
  "displayName": "Kevin McGuire For Francis Howell School Board",
  "description": "Public archive of the Kevin McGuire For Francis Howell School Board Facebook page and its visible discussion threads.",
  "platform": "facebook",
  "sourceUrls": [
    "https://www.facebook.com/profile.php?id=61585372340374"
  ],
  "authorAliases": [
    "Kevin McGuire For Francis Howell School Board"
  ],
  "filenameAliases": [
    "Kevin McGuire For Francis Howell School Board",
    "Kevin_McGuire_For_Francis_Howell_School_Board"
  ],
  "crawl": {
    "comparisonMode": "full_snapshot",
    "requiresCompleteSnapshotForMissing": true,
    "missingRecheckThreshold": 2,
    "confirmationRequiresDirectCheck": true,
    "bulkMissingAbsoluteThreshold": 5,
    "bulkMissingRatioThreshold": 0.1,
    "bulkThreadMissingAbsoluteThreshold": 3
  },
  "publicNotes": "The archive records what the collector observed. Absence from a later crawl is not attributed to a specific person without independent evidence."
}
